{
  "version": "1.0.0",
  "formulaIds": ["weights-v1", "kv-cache-v1", "overhead-v1"],
  "parallelSequences": 1,
  "runtimeProfiles": {
    "lean": {
      "fixedGiB": 0.25,
      "minimumComputeGiB": 0.25,
      "weightBufferFraction": 0.03,
      "minimumSafetyGiB": 0.25,
      "safetyFraction": 0.05
    },
    "balanced": {
      "fixedGiB": 0.50,
      "minimumComputeGiB": 0.50,
      "weightBufferFraction": 0.05,
      "minimumSafetyGiB": 0.50,
      "safetyFraction": 0.10
    },
    "conservative": {
      "fixedGiB": 1.00,
      "minimumComputeGiB": 1.00,
      "weightBufferFraction": 0.08,
      "minimumSafetyGiB": 1.00,
      "safetyFraction": 0.15
    }
  },
  "kvCacheDtypes": {
    "fp16": { "bytesPerElement": 2, "warnIdealized": false },
    "bf16": { "bytesPerElement": 2, "warnIdealized": false },
    "fp32": { "bytesPerElement": 4, "warnIdealized": false },
    "q8_0": { "bytesPerElement": 1, "warnIdealized": true },
    "q4_0": { "bytesPerElement": 0.5, "warnIdealized": true }
  },
  "assumptionLines": [
    "Weight memory is calculated as ceil(parameters * bits_per_weight / 8).",
    "KV cache memory assumes 1 parallel sequence (no batch inference).",
    "KV cache uses 2 * layers * kv_heads * head_dim * context * bytes_per_element.",
    "Quantized KV cache (q8_0, q4_0) use idealized byte estimates; actual implementation may differ.",
    "Runtime fixed overhead is a constant GiB value based on the selected profile.",
    "Compute buffer is the greater of a minimum GiB value or a fraction of weight memory.",
    "Safety margin is the greater of a minimum GiB value or a fraction of the subtotal.",
    "The caller-selected headroom percent is applied separately outside this estimate.",
    "All memory values are estimates and may differ from actual runtime usage."
  ]
}
